{
  "version": 1,
  "charset": { "mode": "hires", "characters": [
    [0,0,0,0,0,0,0,0],
    [255,129,189,165,189,129,255,0],
    [255,255,129,129,129,129,255,255],
    [0,24,60,126,126,60,24,0]
  ] },
  "tileWidth": 4,
  "tileHeight": 2,
  "tiles": [
    { "chars": [64,64,64,64,64,64,64,64], "colors": [6,6,6,6,6,6,6,6], "collision": 0 },
    { "chars": [65,65,65,65,65,65,65,65], "colors": [5,5,5,5,5,5,5,5], "collision": 1 },
    { "chars": [66,66,66,66,66,66,66,66], "colors": [13,13,13,13,13,13,13,13], "collision": 1 },
    { "chars": [64,67,67,64,64,67,67,64], "colors": [6,7,7,6,6,7,7,6], "collision": 0 }
  ],
  "map": { "width": 10, "height": 10, "data": [
    0,0,0,0,0,0,0,0,0,0,
    0,0,3,0,0,0,0,3,0,0,
    0,0,0,0,0,0,0,0,0,0,
    0,0,0,0,2,2,0,0,0,0,
    0,2,2,0,0,0,0,2,2,0,
    0,0,0,0,0,0,0,0,0,0,
    2,2,0,0,2,2,0,0,2,2,
    0,0,0,0,0,0,0,0,0,0,
    1,1,1,1,1,1,1,1,1,1,
    1,1,1,1,1,1,1,1,1,1
  ], "objects": [] }
}
