{
  "version": 1,
  "charset": {
    "mode": "hires",
    "characters": [
      [0, 0, 0, 0, 0, 0, 0, 0],
      [255, 129, 189, 165, 189, 129, 255, 0],
      [60, 126, 255, 255, 255, 255, 126, 60],
      [255, 255, 195, 195, 195, 195, 255, 255]
    ]
  },
  "tileWidth": 1,
  "tileHeight": 1,
  "tiles": [
    { "chars": [0], "colors": [0], "collision": 0 },
    { "chars": [1], "colors": [14], "collision": 1, "properties": { "solid": true } },
    { "chars": [2], "colors": [7], "collision": 0, "properties": { "falling": true } }
  ],
  "map": {
    "width": 10,
    "height": 20,
    "data": [
      0,0,0,0,0,0,0,0,0,0,
      0,0,0,0,0,0,0,0,0,0,
      0,0,0,0,0,0,0,0,0,0,
      0,0,0,0,0,0,0,0,0,0,
      0,0,0,0,0,0,0,0,0,0,
      0,0,0,0,0,0,0,0,0,0,
      0,0,0,0,0,0,0,0,0,0,
      0,0,0,0,0,0,0,0,0,0,
      0,0,0,0,0,0,0,0,0,0,
      0,0,0,0,0,0,0,0,0,0,
      0,0,0,0,0,0,0,0,0,0,
      0,0,0,0,0,0,0,0,0,0,
      0,0,0,0,0,0,0,0,0,0,
      0,0,0,0,0,0,0,0,0,0,
      0,0,0,0,0,0,0,0,0,0,
      0,0,0,0,0,0,0,0,0,0,
      0,0,0,0,0,0,0,0,0,0,
      0,0,0,0,0,0,0,0,0,0,
      0,0,0,0,0,0,0,0,0,0,
      0,0,0,0,0,0,0,0,0,0
    ]
  }
}
