{
  "version": 1,
  "charset": {
    "mode": "hires",
    "characters": [
      [255, 129, 189, 165, 165, 189, 129, 255],
      [24, 60, 126, 255, 255, 126, 60, 24],
      [60, 126, 255, 255, 255, 255, 126, 60]
    ]
  },
  "tileWidth": 1,
  "tileHeight": 1,
  "tiles": [
    { "chars": [32], "colors": [0], "collision": 0, "properties": {} },
    { "chars": [64], "colors": [14], "collision": 1, "properties": { "solid": true } },
    { "chars": [65], "colors": [7], "collision": 0, "properties": { "collectible": true } },
    { "chars": [66], "colors": [5], "collision": 2, "properties": { "snake": true } }
  ],
  "map": {
    "width": 20,
    "height": 15,
    "data": [
      1,1,1,1,1,1,1,1,1,1,1,1,1,1,1,1,1,1,1,1,
      1,0,0,0,0,0,0,0,0,0,0,0,0,0,0,0,0,0,0,1,
      1,0,0,0,0,0,0,0,0,0,0,0,0,0,0,0,0,0,0,1,
      1,0,0,0,0,0,0,0,0,0,0,0,0,0,0,0,0,0,0,1,
      1,0,0,0,0,0,0,0,0,0,0,0,0,0,0,0,0,0,0,1,
      1,0,0,0,0,0,0,0,0,0,0,0,0,0,0,0,0,0,0,1,
      1,0,0,0,0,0,0,0,0,0,0,0,0,0,0,0,0,0,0,1,
      1,0,0,0,0,0,0,0,0,0,0,0,0,0,0,0,0,0,0,1,
      1,0,0,0,0,0,0,0,0,0,0,0,0,0,0,0,0,0,0,1,
      1,0,0,0,0,0,0,0,0,0,0,0,0,0,0,0,0,0,0,1,
      1,0,0,0,0,0,0,0,0,0,0,0,0,0,0,0,0,0,0,1,
      1,0,0,0,0,0,0,0,0,0,0,0,0,0,0,0,0,0,0,1,
      1,0,0,0,0,0,0,0,0,0,0,0,0,0,0,0,0,0,0,1,
      1,0,0,0,0,0,0,0,0,0,0,0,0,0,0,0,0,0,0,1,
      1,1,1,1,1,1,1,1,1,1,1,1,1,1,1,1,1,1,1,1
    ],
    "objects": [
      { "type": "player-spawn", "x": 10, "y": 7, "properties": { "direction": "right" } },
      { "type": "food-spawn", "x": 14, "y": 6, "properties": {} }
    ]
  }
}
