{
  "version": 1,
  "charset": { "mode": "multicolor", "characters": [
    [0,0,0,0,0,0,0,0], [255,195,153,165,165,153,195,255],
    [0,24,24,126,126,24,24,0], [60,126,219,255,255,219,126,60]
  ] },
  "tileWidth": 1,
  "tileHeight": 1,
  "tiles": [
    { "chars": [64], "colors": [0], "collision": 0 },
    { "chars": [65], "colors": [6], "collision": 1, "properties": { "solid": true } },
    { "chars": [66], "colors": [7], "collision": 0, "properties": { "collectible": true } },
    { "chars": [67], "colors": [2], "collision": 0, "properties": { "player": true } }
  ],
  "map": { "width": 20, "height": 15, "data": [
    1,1,1,1,1,1,1,1,1,1,1,1,1,1,1,1,1,1,1,1,
    1,3,0,0,2,0,0,0,1,0,0,0,2,0,0,0,0,2,0,1,
    1,0,1,1,1,0,1,0,1,0,1,1,1,1,1,0,1,1,0,1,
    1,0,1,2,0,0,1,0,0,0,1,0,0,0,0,0,1,2,0,1,
    1,0,1,0,1,1,1,1,1,0,1,0,1,1,1,1,1,0,1,1,
    1,0,0,0,1,0,0,2,0,0,1,0,0,0,0,2,0,0,0,1,
    1,1,1,0,1,0,1,1,1,1,1,1,1,0,1,1,1,1,0,1,
    1,2,0,0,0,0,1,0,0,0,2,0,1,0,0,0,0,1,0,1,
    1,0,1,1,1,1,1,0,1,1,1,0,1,1,1,1,0,1,0,1,
    1,0,0,0,2,0,0,0,1,0,0,0,0,0,0,1,0,0,0,1,
    1,0,1,1,1,1,1,1,1,0,1,1,1,1,0,1,1,1,0,1,
    1,0,1,0,0,0,2,0,0,0,1,0,2,0,0,0,0,1,0,1,
    1,0,1,0,1,1,1,1,1,1,1,0,1,1,1,1,0,1,0,1,
    1,2,0,0,0,0,0,0,0,0,0,0,0,2,0,0,0,0,2,1,
    1,1,1,1,1,1,1,1,1,1,1,1,1,1,1,1,1,1,1,1
  ], "objects": [
    { "type": "player-spawn", "x": 1, "y": 1, "properties": {} },
    { "type": "exit", "x": 18, "y": 13, "properties": { "next": "level-2" } }
  ] }
}
